{
  "date": "2026-08-02",
  "program": [
    { "time": "08:30", "title": "Сбор в джагрити", "note": null },
    { "time": "08:45", "title": "Дхармачакра", "note": null },
    { "time": "10:30", "title": "Свободное время, личные уроки", "note": null },
    { "time": "11:00", "title": "Сатсанг (Индранатха)", "note": "Немного поговорим о том, как у кого дела и как прошла неделя." },
    { "time": "12:00", "title": "Каошики - Тандава", "note": null },
    { "time": "12:10", "title": "Пикник", "note": null }
  ],
  "news": [
    "15 августа — книжный клуб «Война и мир»",
    "10–16 августа — поход (горы Сочи)",
    "2–6 сентября — Южный семинар в Лоо (Нараяна)"
  ],
  "dada_comment": "Наш Дада даст комментарий на следующей неделе, чтобы охватить и этот кусочек, и конец главы.",
  "final_music_url": null
}
